mysql> show databases;
+--------------------+
| Database           |
+--------------------+
| information_schema |
| mysql              |
| nit                |
| performance_schema |
| sys                |
+--------------------+
5 rows in set (0.02 sec)

mysql> use nit;
Database changed
mysql> show tables;
+---------------+
| Tables_in_nit |
+---------------+
| address       |
| customer1     |
| customers     |
| salary        |
| student       |
| student1      |
+---------------+
6 rows in set (0.01 sec)

mysql> select * from students;
ERROR 1146 (42S02): Table 'nit.students' doesn't exist
mysql> select * from student;
+---------+----+---------+-------+
| name    | id | address | marks |
+---------+----+---------+-------+
| prakash | 12 | hyd     |    78 |
| carthy  | 17 | delhi   |    90 |
| kodi    | 40 | bng     |    66 |
| alex    | 45 | chennai |    79 |
| dolly   | 48 | pune    |    67 |
| chancy  | 78 | mumbai  |    34 |
+---------+----+---------+-------+
6 rows in set (0.02 sec)

mysql> delete from student where name = 'kodi';
Query OK, 1 row affected (0.02 sec)

mysql> select * from student;
+---------+----+---------+-------+
| name    | id | address | marks |
+---------+----+---------+-------+
| prakash | 12 | hyd     |    78 |
| carthy  | 17 | delhi   |    90 |
| alex    | 45 | chennai |    79 |
| dolly   | 48 | pune    |    67 |
| chancy  | 78 | mumbai  |    34 |
+---------+----+---------+-------+
5 rows in set (0.00 sec)

mysql> select sum(marks) from students;
ERROR 1146 (42S02): Table 'nit.students' doesn't exist
mysql> select sum(marks) from student;
+------------+
| sum(marks) |
+------------+
|        348 |
+------------+
1 row in set (0.00 sec)

mysql> select avg(marks) from student;
+------------+
| avg(marks) |
+------------+
|    69.6000 |
+------------+
1 row in set (0.00 sec)

mysql> select count(name) from student;
+-------------+
| count(name) |
+-------------+
|           5 |
+-------------+
1 row in set (0.00 sec)

mysql> select max(marks) from student;
+------------+
| max(marks) |
+------------+
|         90 |
+------------+
1 row in set (0.00 sec)

mysql> select min(marks) from student;
+------------+
| min(marks) |
+------------+
|         34 |
+------------+
1 row in set (0.00 sec)

mysql> select * from student order by marks;
+---------+----+---------+-------+
| name    | id | address | marks |
+---------+----+---------+-------+
| chancy  | 78 | mumbai  |    34 |
| dolly   | 48 | pune    |    67 |
| prakash | 12 | hyd     |    78 |
| alex    | 45 | chennai |    79 |
| carthy  | 17 | delhi   |    90 |
+---------+----+---------+-------+
5 rows in set (0.00 sec)

mysql> select * from student where a like 'a&';
ERROR 1054 (42S22): Unknown column 'a' in 'where clause'
mysql> select * from student where name like 'a&';
Empty set (0.00 sec)

mysql> select * from student where name like 'a%';
+------+----+---------+-------+
| name | id | address | marks |
+------+----+---------+-------+
| alex | 45 | chennai |    79 |
+------+----+---------+-------+
1 row in set (0.00 sec)

mysql> select * from student where name like '%y';
+--------+----+---------+-------+
| name   | id | address | marks |
+--------+----+---------+-------+
| carthy | 17 | delhi   |    90 |
| dolly  | 48 | pune    |    67 |
| chancy | 78 | mumbai  |    34 |
+--------+----+---------+-------+
3 rows in set (0.00 sec)

mysql> select * from student where name like '_a%';
+--------+----+---------+-------+
| name   | id | address | marks |
+--------+----+---------+-------+
| carthy | 17 | delhi   |    90 |
+--------+----+---------+-------+
1 row in set (0.00 sec)

mysql> select * from student where name like '%s_';
+---------+----+---------+-------+
| name    | id | address | marks |
+---------+----+---------+-------+
| prakash | 12 | hyd     |    78 |
+---------+----+---------+-------+
1 row in set (0.00 sec)

mysql> create table emp(id int not null primary key,salary int,empcode int,name varchar(30));
Query OK, 0 rows affected (0.03 sec)

mysql> insert into emp values(12,20000,102,'aman'),(23,60000,104,'arup'),(78,30000,105,'max'),(80,25000,103,'ram'),(34,90000,106,'sam');
Query OK, 5 rows affected (0.02 sec)
Records: 5  Duplicates: 0  Warnings: 0

mysql> select * from emp;
+----+--------+---------+------+
| id | salary | empcode | name |
+----+--------+---------+------+
| 12 |  20000 |     102 | aman |
| 23 |  60000 |     104 | arup |
| 34 |  90000 |     106 | sam  |
| 78 |  30000 |     105 | max  |
| 80 |  25000 |     103 | ram  |
+----+--------+---------+------+
5 rows in set (0.00 sec)

mysql> select * from student;
+---------+----+---------+-------+
| name    | id | address | marks |
+---------+----+---------+-------+
| prakash | 12 | hyd     |    78 |
| carthy  | 17 | delhi   |    90 |
| alex    | 45 | chennai |    79 |
| dolly   | 48 | pune    |    67 |
| chancy  | 78 | mumbai  |    34 |
+---------+----+---------+-------+
5 rows in set (0.00 sec)

mysql> select * from emp;
+----+--------+---------+------+
| id | salary | empcode | name |
+----+--------+---------+------+
| 12 |  20000 |     102 | aman |
| 23 |  60000 |     104 | arup |
| 34 |  90000 |     106 | sam  |
| 78 |  30000 |     105 | max  |
| 80 |  25000 |     103 | ram  |
+----+--------+---------+------+
5 rows in set (0.00 sec)

mysql> select * from student inner join emp on student.id=emp.id;
+---------+----+---------+-------+----+--------+---------+------+
| name    | id | address | marks | id | salary | empcode | name |
+---------+----+---------+-------+----+--------+---------+------+
| prakash | 12 | hyd     |    78 | 12 |  20000 |     102 | aman |
| chancy  | 78 | mumbai  |    34 | 78 |  30000 |     105 | max  |
+---------+----+---------+-------+----+--------+---------+------+
2 rows in set (0.00 sec)

mysql> select * from emp;
+----+--------+---------+------+
| id | salary | empcode | name |
+----+--------+---------+------+
| 12 |  20000 |     102 | aman |
| 23 |  60000 |     104 | arup |
| 34 |  90000 |     106 | sam  |
| 78 |  30000 |     105 | max  |
| 80 |  25000 |     103 | ram  |
+----+--------+---------+------+
5 rows in set (0.00 sec)

mysql> select * from student;
+---------+----+---------+-------+
| name    | id | address | marks |
+---------+----+---------+-------+
| prakash | 12 | hyd     |    78 |
| carthy  | 17 | delhi   |    90 |
| alex    | 45 | chennai |    79 |
| dolly   | 48 | pune    |    67 |
| chancy  | 78 | mumbai  |    34 |
+---------+----+---------+-------+
5 rows in set (0.00 sec)

mysql> select * from emp inner join student on emp.id=student.id;
+----+--------+---------+------+---------+----+---------+-------+
| id | salary | empcode | name | name    | id | address | marks |
+----+--------+---------+------+---------+----+---------+-------+
| 12 |  20000 |     102 | aman | prakash | 12 | hyd     |    78 |
| 78 |  30000 |     105 | max  | chancy  | 78 | mumbai  |    34 |
+----+--------+---------+------+---------+----+---------+-------+
2 rows in set (0.00 sec)

mysql> select * from student left join emp on student.id=emp.id;
+---------+----+---------+-------+------+--------+---------+------+
| name    | id | address | marks | id   | salary | empcode | name |
+---------+----+---------+-------+------+--------+---------+------+
| prakash | 12 | hyd     |    78 |   12 |  20000 |     102 | aman |
| carthy  | 17 | delhi   |    90 | NULL |   NULL |    NULL | NULL |
| alex    | 45 | chennai |    79 | NULL |   NULL |    NULL | NULL |
| dolly   | 48 | pune    |    67 | NULL |   NULL |    NULL | NULL |
| chancy  | 78 | mumbai  |    34 |   78 |  30000 |     105 | max  |
+---------+----+---------+-------+------+--------+---------+------+
5 rows in set (0.00 sec)

mysql> select * from emp left join student on emp.id=student.id;
+----+--------+---------+------+---------+------+---------+-------+
| id | salary | empcode | name | name    | id   | address | marks |
+----+--------+---------+------+---------+------+---------+-------+
| 12 |  20000 |     102 | aman | prakash |   12 | hyd     |    78 |
| 23 |  60000 |     104 | arup | NULL    | NULL | NULL    |  NULL |
| 34 |  90000 |     106 | sam  | NULL    | NULL | NULL    |  NULL |
| 78 |  30000 |     105 | max  | chancy  |   78 | mumbai  |    34 |
| 80 |  25000 |     103 | ram  | NULL    | NULL | NULL    |  NULL |
+----+--------+---------+------+---------+------+---------+-------+
5 rows in set (0.00 sec)

mysql> select * from student right join emp on student.id=emp.id;
+---------+------+---------+-------+----+--------+---------+------+
| name    | id   | address | marks | id | salary | empcode | name |
+---------+------+---------+-------+----+--------+---------+------+
| prakash |   12 | hyd     |    78 | 12 |  20000 |     102 | aman |
| NULL    | NULL | NULL    |  NULL | 23 |  60000 |     104 | arup |
| NULL    | NULL | NULL    |  NULL | 34 |  90000 |     106 | sam  |
| chancy  |   78 | mumbai  |    34 | 78 |  30000 |     105 | max  |
| NULL    | NULL | NULL    |  NULL | 80 |  25000 |     103 | ram  |
+---------+------+---------+-------+----+--------+---------+------+
5 rows in set (0.00 sec)

mysql> select * from student cross join emp;
+---------+----+---------+-------+----+--------+---------+------+
| name    | id | address | marks | id | salary | empcode | name |
+---------+----+---------+-------+----+--------+---------+------+
| chancy  | 78 | mumbai  |    34 | 12 |  20000 |     102 | aman |
| dolly   | 48 | pune    |    67 | 12 |  20000 |     102 | aman |
| alex    | 45 | chennai |    79 | 12 |  20000 |     102 | aman |
| carthy  | 17 | delhi   |    90 | 12 |  20000 |     102 | aman |
| prakash | 12 | hyd     |    78 | 12 |  20000 |     102 | aman |
| chancy  | 78 | mumbai  |    34 | 23 |  60000 |     104 | arup |
| dolly   | 48 | pune    |    67 | 23 |  60000 |     104 | arup |
| alex    | 45 | chennai |    79 | 23 |  60000 |     104 | arup |
| carthy  | 17 | delhi   |    90 | 23 |  60000 |     104 | arup |
| prakash | 12 | hyd     |    78 | 23 |  60000 |     104 | arup |
| chancy  | 78 | mumbai  |    34 | 34 |  90000 |     106 | sam  |
| dolly   | 48 | pune    |    67 | 34 |  90000 |     106 | sam  |
| alex    | 45 | chennai |    79 | 34 |  90000 |     106 | sam  |
| carthy  | 17 | delhi   |    90 | 34 |  90000 |     106 | sam  |
| prakash | 12 | hyd     |    78 | 34 |  90000 |     106 | sam  |
| chancy  | 78 | mumbai  |    34 | 78 |  30000 |     105 | max  |
| dolly   | 48 | pune    |    67 | 78 |  30000 |     105 | max  |
| alex    | 45 | chennai |    79 | 78 |  30000 |     105 | max  |
| carthy  | 17 | delhi   |    90 | 78 |  30000 |     105 | max  |
| prakash | 12 | hyd     |    78 | 78 |  30000 |     105 | max  |
| chancy  | 78 | mumbai  |    34 | 80 |  25000 |     103 | ram  |
| dolly   | 48 | pune    |    67 | 80 |  25000 |     103 | ram  |
| alex    | 45 | chennai |    79 | 80 |  25000 |     103 | ram  |
| carthy  | 17 | delhi   |    90 | 80 |  25000 |     103 | ram  |
| prakash | 12 | hyd     |    78 | 80 |  25000 |     103 | ram  |
+---------+----+---------+-------+----+--------+---------+------+
25 rows in set (0.00 sec)
